{
  "version": 1,
  "site": "solelis",
  "id": "2e309e2b0bbd96df165be769512ec79ad2beaec4",
  "slug": "commerces-touches-par-les-manifestations-des-ouvertures-le-dimanche-2e309e",
  "titre": "Commerces touchés par les manifestations : des ouvertures le dimanche jusqu'à Noël",
  "chapo": "Le gouvernement veut aider les commerçants pénalisés par les manifestations du samedi. Maires et préfets seront encouragés à autoriser des ouvertures exceptionnelles le dimanche d'ici aux fêtes.",
  "blocs": [
    {
      "intertitre": null,
      "paragraphes": [
        "L'annonce a été faite jeudi 29 octobre par Maud Bregeon, porte-parole du gouvernement, sur BFMTV et RMC. L'objectif est de permettre aux boutiques qui ont perdu du chiffre d'affaires pendant les cortèges du samedi de compenser une partie de ces pertes avant Noël. Selon elle, la mesure répond à une demande venue des commerçants."
      ]
    },
    {
      "intertitre": "Un accord de principe du ministre du Travail",
      "paragraphes": [
        "Jean-Pierre Farandou, ministre du Travail, a lui aussi soutenu cette idée le même jour sur France Inter. Il souhaite toutefois vérifier au préalable que les magasins visés par des dégradations ou des pillages ont pu être réparés et sont en mesure de rouvrir dans de bonnes conditions.",
        "Il a aussi précisé que ces dimanches travaillés reposeraient uniquement sur des salariés volontaires, par solidarité avec des professions durement touchées."
      ]
    },
    {
      "intertitre": "Une fin d'année redoutée",
      "paragraphes": [
        "Nombre de commerçants redoutent que les clients se fassent plus rares avant les fêtes, une période décisive pour leurs ventes. En temps normal, le Code du travail permet déjà au maire d'accorder jusqu'à douze dimanches d'ouverture par an aux commerces de détail, après avis du conseil municipal."
      ]
    }
  ],
  "mots": 208,
  "lecture_min": 1,
  "theme": "entreprises",
  "pays": [
    "FR"
  ],
  "source_nom": "20 Minutes",
  "source_url": "https://www.20minutes.fr/economie/4258521-20261029-manifestations-gouvernement-veut-faciliter-ouverture-dimanche-jusqu-noel-rattraper-manque-gagner?at_medium=display&at_campaign=149",
  "publie_le": "2026-10-29T12:11:51.000Z",
  "redige_le": "2026-10-29T18:22:46.213Z",
  "image": {
    "url": "https://teiki5320.github.io/veille/cartes/solelis/2e309e2b0bbd96df165be769512ec79ad2beaec4.svg",
    "source": "carte",
    "credit": "Illustration : Solelis",
    "licence": null,
    "page": null,
    "alt": "Illustration Solelis avec la mention « Entreprises »",
    "mots_cles": [
      "Maud Bregeon",
      "shopping street france",
      "shop window"
    ],
    "largeur": 1600,
    "hauteur": 900
  }
}
