{
  "version": 1,
  "site": "keurfoot",
  "id": "eff05f6cce33fcf8d481c5f6a90a6d0522299a54",
  "slug": "mamelodi-sundowns-sorti-des-le-2e-tour-preliminaire-de-la-ligue-des-eff05f",
  "titre": "Mamelodi Sundowns sorti dès le 2e tour préliminaire de la Ligue des champions CAF",
  "chapo": "Tenant du titre, Mamelodi Sundowns ne disputera pas la phase de groupes de la Ligue des champions CAF. Le club sud-africain est tombé au deuxième tour préliminaire face aux Angolais de Wiliete.",
  "blocs": [
    {
      "intertitre": null,
      "paragraphes": [
        "Les Masandawana pensaient avoir fait le plus dur en ramenant un 0-0 de Benguela. Au retour, vendredi 23 octobre au Loftus Versfeld de Pretoria, ils ont ouvert le score dès la 11e minute par Tashreeq Matthews.",
        "Juste après la pause, l'attaquant Mabululu a égalisé pour Wiliete. Malgré leurs assauts, les Sud-Africains n'ont plus marqué. Avec 1-1 au total, le but obtenu à l'extérieur a envoyé les Angolais en phase de groupes."
      ]
    },
    {
      "intertitre": "Une série brutalement stoppée",
      "paragraphes": [
        "L'élimination met fin à une longue régularité. Sundowns restait sur dix présences de suite dans la compétition et avait disputé les deux dernières finales. Le club de Pretoria a remporté le trophée en 2016 puis en 2026.",
        "D'après la presse sud-africaine, il n'avait plus été écarté à ce stade depuis 2015, à l'époque de l'entraîneur Pitso Mosimane. Pour un club habitué aux derniers carrés de l'épreuve, le coup est particulièrement rude."
      ]
    },
    {
      "intertitre": "Un précédent rare",
      "paragraphes": [
        "Voir le champion sortant chuter avant la phase de groupes reste exceptionnel. Avant Sundowns, l'Étoile du Sahel en Tunisie, Al Ahly en Égypte et le Raja Casablanca au Maroc avaient déjà subi pareille déconvenue, il y a plusieurs années.",
        "La Confédération africaine de football range d'ailleurs cette qualification de Wiliete, club fondé en 2018, parmi les plus grosses surprises de l'histoire de l'épreuve."
      ]
    },
    {
      "intertitre": "Orlando Pirates seul en lice",
      "paragraphes": [
        "L'Afrique du Sud garde tout de même un représentant. Orlando Pirates, vainqueur de la compétition en 1995, s'est qualifié en battant les Namibiens d'African Stars, 5-0 sur les deux matchs. Sundowns, lui, devra attendre la saison prochaine pour retrouver la scène continentale dans cette épreuve, qu'il avait l'habitude de dominer ces dernières années."
      ]
    }
  ],
  "mots": 302,
  "lecture_min": 1,
  "theme": "foot",
  "pays": [
    "ZA"
  ],
  "competition": "Ligue des champions CAF",
  "source_nom": "Africa Top Sports",
  "source_url": "https://africatopsports.com/football/ligue-des-champions-caf-mamelodi-sundowns-le-grand-absent-de-la-saison/",
  "autres_sources": [
    "https://www.cafonline.com/caf-champions-league/news/angola-s-wiliete-dethrones-holders-mamelodi-sundowns-in-totalenergies-caf-champions-league-biggest-shock/",
    "https://briefly.co.za/sports/football/256963-mamelodi-sundowns-crash-caf-champions-league-wiliete-sc-shock/"
  ],
  "publie_le": "2026-10-27T16:17:56.000Z",
  "redige_le": "2026-10-28T00:38:05.073Z",
  "image": {
    "url": "https://teiki5320.github.io/veille/images/keurfoot/eff05f6cce33fcf8d481c5f6a90a6d0522299a54.webp",
    "source": "wikimedia",
    "credit": "Carlo Bruil Fotografie",
    "licence": "CC BY 2.0",
    "page": "https://commons.wikimedia.org/wiki/File:Go_Ahead_Eagles_-_Mamelodi_Sundowns_FC_-_53066145739.jpg",
    "alt": "Le club de football sud-africain Mamelodi Sundowns",
    "mots_cles": [
      "Mamelodi Sundowns F.C."
    ],
    "largeur": 1600,
    "hauteur": 900
  }
}
