{
  "version": 1,
  "site": "keurfoot",
  "id": "6f3c28e0a8a87bf0d90b358a8219075ac235f90e",
  "slug": "c1-africaine-les-soudanais-al-hilal-omdurman-de-nouveau-qualifies-pour-6f3c28",
  "titre": "C1 africaine : les Soudanais d'Al Hilal Omdurman de nouveau qualifiés pour les poules",
  "chapo": "Al Hilal Omdurman sera de nouveau du tour principal de la C1 africaine, réservé à seize clubs. Le club soudanais y participera pour la quinzième fois de son histoire.",
  "blocs": [
    {
      "intertitre": null,
      "paragraphes": [
        "La liste des participants au tour principal est connue depuis le week-end. Al Hilal Omdurman y figure, après avoir franchi les deux tours préliminaires sans encaisser le moindre but."
      ]
    },
    {
      "intertitre": "Une régularité remarquable",
      "paragraphes": [
        "Le club soudanais se qualifie pour la huitième saison consécutive à ce stade de l'épreuve. Il compte désormais quinze participations à la phase de groupes, ce qui le place parmi les clubs les plus constants du continent.",
        "Lors de la dernière édition, l'aventure s'était arrêtée en quarts de finale."
      ]
    },
    {
      "intertitre": "Un titre qui se refuse",
      "paragraphes": [
        "Malgré cette présence quasi permanente, Al Hilal n'a encore jamais gagné la compétition. Il a disputé deux finales, en 1987 et en 1991, sans les remporter.",
        "Cette saison, le club veut enfin convertir son expérience en premier sacre continental. Il devra le faire dans un contexte difficile : le Soudan est en guerre depuis avril 2023, ce qui a profondément désorganisé le football local."
      ]
    }
  ],
  "mots": 179,
  "lecture_min": 1,
  "theme": "foot",
  "pays": [
    "SD"
  ],
  "competition": "Ligue des champions CAF",
  "source_nom": "Africa Top Sports",
  "source_url": "https://africatopsports.com/caf/ligue-des-champions-caf/ligue-des-champions-caf-al-hilal-omdurman-une-regularite-qui-peine-a-simposer/",
  "publie_le": "2026-10-27T14:20:30.000Z",
  "redige_le": "2026-10-28T00:38:05.073Z",
  "image": {
    "url": "https://teiki5320.github.io/veille/cartes/keurfoot/6f3c28e0a8a87bf0d90b358a8219075ac235f90e.svg",
    "source": "carte",
    "credit": "Illustration : Keur Foot",
    "licence": null,
    "page": null,
    "alt": "Illustration Keur Foot avec le drapeau national (Soudan) et la mention « Ligue des champions CAF »",
    "mots_cles": [
      "Al-Hilal Club (Omdurman)",
      "african football stadium",
      "football fans africa"
    ],
    "largeur": 1600,
    "hauteur": 900
  }
}
