{
  "version": 1,
  "site": "keurfoot",
  "id": "58fc607e6b292363b5f8d49324e7dc1c70fef6a9",
  "slug": "serie-algerien-rafik-belghali-impose-comme-une-revelation-au-torino-58fc60",
  "titre": "Serie A : l'Algérien Rafik Belghali s'impose comme une révélation au Torino",
  "chapo": "Arrivé au Torino en toute fin de mercato, le latéral algérien Rafik Belghali s'est vite imposé. Auteur d'un but et de trois passes, il compte parmi les bonnes surprises du début de saison en Serie A.",
  "blocs": [
    {
      "intertitre": null,
      "paragraphes": [
        "À 24 ans, Rafik Belghali a pris une place de titulaire dans le couloir droit du Torino. Au bout de six matchs de championnat joués par le club piémontais, il a déjà marqué une fois et offert trois buts à ses partenaires, pour 349 minutes de jeu, selon Foot Mercato.",
        "Son entrée en matière a été rapide. Remplaçant au départ, il a servi un coéquipier le 5 septembre face à la Fiorentina, à peine plus d'une demi-heure après être entré en jeu. Face à Parme, il a ensuite délivré deux passes décisives dans le même match."
      ]
    },
    {
      "intertitre": "Un transfert conclu sur le fil",
      "paragraphes": [
        "Né à Louvain, en Belgique, l'international algérien sortait d'une première saison dans l'élite italienne sous le maillot de Vérone : 26 matchs et deux buts en 2025-2026. Relégué, le club vénitien devait vendre. Plusieurs clubs suivaient le joueur, dont la Roma, l'Inter, Newcastle et Marseille.",
        "Sassuolo semblait proche de conclure, mais le Torino l'a emporté dans les dernières heures. Le montage prévoit un prêt d'un million d'euros, un achat obligatoire fixé à cinq millions, un bonus d'un million et 10 % d'une future plus-value pour Vérone. Le Torino voulait ainsi succéder à Marcus Pedersen, transféré à l'Olympiakos."
      ]
    },
    {
      "intertitre": "Des chiffres de créateur",
      "paragraphes": [
        "Sa moyenne atteint 0,78 passe décisive toutes les 90 minutes. Il devance ainsi des joueurs comme Paulo Dybala, Ivan Ilic ou Andy Diouf dans ce classement. Il a pris le dessus sur ses concurrents de couloir, notamment Fortini et Patterson. Il peut aussi jouer sur l'aile gauche.",
        "Son entraîneur, Ignazio Abate, ancien latéral lui-même, a salué ses qualités dans le dernier tiers et ses progrès défensifs après la victoire contre Monza. Le joueur explique de son côté que son coach lui parle beaucoup, y compris hors du terrain."
      ]
    },
    {
      "intertitre": "Une valeur en hausse",
      "paragraphes": [
        "Le Torino occupe la 8e place de Serie A. Si Belghali garde ce rythme, sa cote pourrait encore grimper dans les prochains mois, alors que son contrat a été conclu sous forme de prêt avec achat obligatoire."
      ]
    }
  ],
  "mots": 368,
  "lecture_min": 2,
  "theme": "foot",
  "pays": [
    "DZ",
    "IT"
  ],
  "competition": "Serie A",
  "source_nom": "Foot Mercato",
  "source_url": "https://www.footmercato.net/a5334343792104998872-torino-litalie-est-en-train-de-tomber-amoureuse-de-rafik-belghali",
  "publie_le": "2026-10-27T16:07:08.000Z",
  "redige_le": "2026-10-28T00:38:05.073Z",
  "image": {
    "url": "https://teiki5320.github.io/veille/cartes/keurfoot/58fc607e6b292363b5f8d49324e7dc1c70fef6a9.svg",
    "source": "carte",
    "credit": "Illustration : Keur Foot",
    "licence": null,
    "page": null,
    "alt": "Illustration Keur Foot avec le drapeau national (Algérie) et la mention « Serie A »",
    "mots_cles": [
      "Rafik Belghali",
      "torino football",
      "serie a football"
    ],
    "largeur": 1600,
    "hauteur": 900
  }
}
