{
  "version": 1,
  "site": "keurfoot",
  "id": "446bf49cbaeced9cff3d5d9092e7a028ded24c5c",
  "slug": "arabie-saoudite-al-faisaly-et-abdoulaye-seck-imposent-1-0-abha-446bf4",
  "titre": "Arabie saoudite : Al-Faisaly et Abdoulaye Seck s'imposent 1-0 à Abha",
  "chapo": "Al-Faisaly, club du défenseur sénégalais Abdoulaye Seck, s'est imposé 1-0 sur la pelouse d'Abha mardi. Ce deuxième succès de la saison en championnat compte dans la bataille pour rester en première division.",
  "blocs": [
    {
      "intertitre": null,
      "paragraphes": [
        "La rencontre comptait pour la 8e journée de la Saudi Pro League, disputée en retard. Abha, lanterne rouge et toujours sans victoire, a longtemps tenu le choc.",
        "Le seul but est venu à la 70e minute. Le Brésilien Flàvio a tenté sa chance de loin, à environ vingt-cinq mètres, et a trouvé le fond des filets. Al-Faisaly a ensuite gardé son avantage jusqu'au bout, sans trembler face à un adversaire en manque de solutions."
      ]
    },
    {
      "intertitre": "Un début de saison compliqué",
      "paragraphes": [
        "Promu cette saison, Al-Faisaly n'avait gagné qu'une seule fois après onze journées, contre Kholood. Son parcours avait mal commencé, avec un revers 4-2 face à Al Hilal, qui était aussi le premier match officiel de Seck sous ses nouvelles couleurs.",
        "Ces trois points à l'extérieur permettent au club de souffler un peu dans le bas du classement. La Saudi Pro League réunit dix-huit équipes, et les trois dernières descendent à l'issue de la saison. Chaque victoire face à un concurrent direct pèse donc double dans ce contexte."
      ]
    },
    {
      "intertitre": "Seck, l'expérience en défense",
      "paragraphes": [
        "Âgé de 34 ans, Abdoulaye Seck est champion d'Afrique avec le Sénégal. Libre depuis qu'il avait quitté le Maccabi Haïfa au mois de mai, il a été recruté par Al-Faisaly pour encadrer un groupe ambitieux.",
        "Les dirigeants comptent sur son physique et son sens du duel pour donner de la stabilité à une arrière-garde fragile. L'équipe s'est aussi renforcée en attaque avec Alexandre Mendy.",
        "Le défenseur central avait passé plusieurs saisons en Israël avant de rejoindre le championnat saoudien. Pour Al-Faisaly, l'enjeu des prochaines semaines reste de s'éloigner de la zone de relégation et d'enchaîner enfin les résultats."
      ]
    }
  ],
  "mots": 300,
  "lecture_min": 1,
  "theme": "foot",
  "pays": [
    "SN",
    "SA"
  ],
  "competition": "Saudi Pro League",
  "source_nom": "Wiwsport",
  "source_url": "https://wiwsport.com/2026/10/27/saudi-pro-league-al-faisaly-dabdoulaye-seck-soffre-une-victoire-precieuse-face-a-abha-0-1/",
  "autres_sources": [
    "https://senego.com/al-faisaly-dabdoulaye-seck-bat-abha-0-1-et-relance-sa-lutte-pour-le-maintien_2017882.html"
  ],
  "publie_le": "2026-10-27T14:52:28.000Z",
  "redige_le": "2026-10-28T00:38:05.073Z",
  "image": {
    "url": "https://teiki5320.github.io/veille/images/keurfoot/446bf49cbaeced9cff3d5d9092e7a028ded24c5c.webp",
    "source": "wikimedia",
    "credit": "feguifoot",
    "licence": "Public domain",
    "page": "https://commons.wikimedia.org/wiki/File:Abdoulaye_Seck.jpg",
    "alt": "Abdoulaye Seck, défenseur international sénégalais",
    "mots_cles": [
      "Abdoulaye Seck"
    ],
    "largeur": 1600,
    "hauteur": 900
  }
}
