{
  "version": 1,
  "site": "keurfoot",
  "id": "1e486a8459319d621082d29798e1bf4ad1805576",
  "slug": "senegal-pape-gueye-explique-sur-sa-sortie-rapide-contre-les-belges-au-1e486a",
  "titre": "Sénégal : Pape Guèye s'explique sur sa sortie rapide contre les Belges au Mondial",
  "chapo": "Le milieu Pape Guèye a reparlé de sa Coupe du monde difficile et de son remplacement précoce lors de la défaite contre la Belgique. L'international sénégalais admet avoir réagi à chaud, sous le coup de la frustration.",
  "blocs": [
    {
      "intertitre": null,
      "paragraphes": [
        "Le joueur de Villarreal s'est exprimé lors d'un passage dans Talents d'Afrique, une émission de Canal+. Il y a raconté avoir passé une saison entière à se préparer pour le Mondial, en finançant lui-même un suivi médical et physique, avec ses propres kinés et préparateurs.",
        "Cette préparation n'a pas suffi. Contre la Belgique, il est sorti tôt dans la partie, et les Lions ont été éliminés. Quelques jours plus tôt, le 16 juin, le Sénégal avait affronté la France en phase de groupes."
      ]
    },
    {
      "intertitre": "Une élimination cruelle",
      "paragraphes": [
        "Le scénario du match a pesé lourd. En seconde période, le Sénégal menait 2-0, sur des buts de Habib Diarra puis d'Ismaïla Sarr. La Belgique est revenue au score dans les dernières minutes, en marquant à la 86e puis à la 89e minute.",
        "Les Belges ont finalement gagné 3-2, sur un penalty en fin de prolongation. Pour Pape Guèye, sa sortie rapide et cette défaite ont formé un ensemble très frustrant, selon des propos rapportés par Senenews."
      ]
    },
    {
      "intertitre": "Une page tournée",
      "paragraphes": [
        "Le milieu reconnaît que sa réaction de l'époque était dictée par l'émotion. Il dit aujourd'hui considérer cet épisode comme derrière lui.",
        "Juste après l'élimination, il avait toutefois lié son retour en sélection au départ de l'encadrement technique. Il a depuis repris sa place chez les Lions, désormais dirigés par Patrick Vieira, nommé en septembre. Début octobre, il avait expliqué que l'arrivée du nouveau staff avait tout changé pour lui.",
        "Pape Guèye estime que ce Mondial l'a fait grandir et qu'il en a tiré des leçons. Il veut désormais participer aux prochains succès du Sénégal, champion d'Afrique en titre après son sacre à la CAN 2025, et continuer à progresser."
      ]
    }
  ],
  "mots": 312,
  "lecture_min": 1,
  "theme": "foot",
  "pays": [
    "SN"
  ],
  "competition": "Coupe du monde 2026",
  "source_nom": "Senego",
  "source_url": "https://senego.com/apres-son-mondial-difficile-pape-gueye-revient-sur-sa-sortie-contre-la-belgique_2017905.html",
  "publie_le": "2026-10-27T15:33:19.000Z",
  "redige_le": "2026-10-28T00:38:05.073Z",
  "image": {
    "url": "https://teiki5320.github.io/veille/images/keurfoot/1e486a8459319d621082d29798e1bf4ad1805576.webp",
    "source": "wikimedia",
    "credit": "Bryan Berlin",
    "licence": "CC BY-SA 4.0",
    "page": "https://commons.wikimedia.org/wiki/File:Pape_Gueye_France_v_Senegal_16_June_2026-359.jpg",
    "alt": "Pape Guèye, milieu de terrain international sénégalais",
    "mots_cles": [
      "Pape Gueye"
    ],
    "largeur": 1600,
    "hauteur": 900
  }
}
