{
  "version": 1,
  "site": "keurfoot",
  "id": "a55e72af8849b04f80a1b30e35ccad2950cbfdd6",
  "slug": "ballon-or-africain-2026-pape-gueye-assume-viser-le-trophee-a55e72",
  "titre": "Ballon d'Or africain 2026 : Pape Gueye assume viser le trophée",
  "chapo": "Pape Gueye ne cache pas ses ambitions. Le milieu de terrain du Sénégal se dit candidat au Ballon d'Or africain 2026, qui sera décerné début décembre au Nigeria.",
  "blocs": [
    {
      "intertitre": null,
      "paragraphes": [
        "Invité du magazine « Talents d'Afrique », diffusé sur Canal+ Sport Afrique, le joueur de Villarreal, 27 ans, a expliqué qu'il se fixe chaque début de saison des objectifs précis : nombre de buts, de passes décisives et de matchs joués, mais aussi trophées collectifs et individuels. Le Ballon d'Or africain figurait sur sa liste.",
        "La cérémonie est prévue le 7 décembre à Lagos. Le Sénégalais assure ne pas vouloir se mettre en avant, tout en estimant avoir réussi de belles choses et marqué à des moments clés pour son pays. Il dit attendre le vote avec l'espoir d'une bonne nouvelle, rappelant que la décision ne lui appartient pas."
      ]
    },
    {
      "intertitre": "Une saison marquante",
      "paragraphes": [
        "Sélectionné à 48 reprises pour 7 buts, l'ancien joueur de l'Olympique de Marseille a été désigné meilleur joueur africain de la Liga la saison passée. Il a surtout marqué le seul but de la dernière finale de CAN, disputée face au Maroc le 18 janvier à Rabat et conclue après prolongation.",
        "Ce succès sportif lui a toutefois été retiré : l'instance d'appel de la CAF a ensuite attribué la victoire aux Marocains. Le Sénégal a contesté cette décision devant le Tribunal arbitral du sport."
      ]
    },
    {
      "intertitre": "Le TAS en arrière-plan",
      "paragraphes": [
        "Le TAS doit se prononcer fin novembre sur ce recours. Sa décision, rendue quelques jours avant la cérémonie de Lagos, pourrait peser dans l'esprit des votants.",
        "Pape Gueye bénéficie déjà d'un soutien de poids dans son vestiaire : son coéquipier ivoirien Nicolas Pépé a estimé à la mi-octobre, sur DAZN, qu'un sacre du Sénégalais serait entièrement mérité. Le Ballon d'Or africain est décerné chaque année par la Confédération africaine de football au meilleur joueur du continent."
      ]
    }
  ],
  "mots": 304,
  "lecture_min": 1,
  "theme": "foot",
  "pays": [
    "SN"
  ],
  "competition": "Ballon d'Or africain",
  "source_nom": "Afrik-Foot",
  "source_url": "https://www.afrik-foot.com/ballon-dor-africain-jai-fait-pas-mal-de-bonnes-choses-un-senegalais-fait-acte-de-candidature",
  "publie_le": "2026-10-27T18:38:42.000Z",
  "redige_le": "2026-10-28T11:28:07.557Z",
  "image": {
    "url": "https://teiki5320.github.io/veille/images/keurfoot/a55e72af8849b04f80a1b30e35ccad2950cbfdd6.webp",
    "source": "wikimedia",
    "credit": "Supporterhéninois",
    "licence": "CC0",
    "page": "https://commons.wikimedia.org/wiki/File:Lens_-_Le_Havre_AC_(01-04-2019)_44.jpg",
    "alt": "Le milieu de terrain sénégalais Pape Gueye",
    "mots_cles": [
      "Pape Gueye"
    ],
    "largeur": 1600,
    "hauteur": 900
  }
}
