{
  "version": 1,
  "site": "keurfoot",
  "id": "13c6e86581517be5969d48dcc31c8efef0cd4f03",
  "slug": "senegal-patrick-vieira-toujours-invaincu-avant-la-fenetre-de-novembre-13c6e8",
  "titre": "Sénégal : Patrick Vieira toujours invaincu avant la fenêtre de novembre",
  "chapo": "Arrivé sur le banc du Sénégal après le Mondial 2026, Patrick Vieira n'a pas encore perdu : deux victoires et un nul en trois matchs. Les Lions comptent 4 points sur 6 dans leur groupe qualificatif.",
  "blocs": [
    {
      "intertitre": null,
      "paragraphes": [
        "L'ancien capitaine de l'équipe de France a été nommé après la sortie du Sénégal au stade des huitièmes du Mondial, face à la Belgique (3-2 après prolongation).",
        "Ses débuts officiels ont eu lieu le 25 septembre à Maputo. Le Sénégal y a concédé le nul 1-1 contre le Mozambique, malgré l'ouverture du score de Nicolas Jackson à la 32e minute. Quatre jours après, en Éthiopie, à Bahir Dar, c'est Ibrahim Mbaye qui a donné la victoire aux Lions face à l'Éthiopie (1-0) dès la 11e minute, sur une passe de Jackson.",
        "Le rassemblement s'est conclu le 4 octobre par un succès amical 1-0 contre les Comores, au Vélodrome de Marseille."
      ]
    },
    {
      "intertitre": "Un bilan comptable, un jeu encore en chantier",
      "paragraphes": [
        "En Éthiopie, les Sénégalais ont bien contrôlé la première période avant de subir après la pause. Ils ont toutefois gardé leur but inviolé. L'équipe n'avait remporté qu'un seul de ses sept matchs précédents.",
        "Vieira a lui-même désigné le manque de réalisme offensif comme son principal chantier."
      ]
    },
    {
      "intertitre": "Deuxième du groupe J",
      "paragraphes": [
        "Avec 4 points, les Lions sont deuxièmes de la poule J. Le Mozambique, vainqueur du Soudan 4-1, en a autant. L'Éthiopie et le Soudan suivent. Les deux premiers iront à la phase finale. Elle se jouera en Afrique de l'Est, dans trois pays hôtes, entre le 19 juin et le 17 juillet 2027.",
        "La prochaine fenêtre, celle des 3e et 4e journées, s'étend du 9 au 17 novembre. Sur leurs quatre derniers matchs de poule, les Lions en disputeront trois à domicile. La dernière fenêtre est fixée en mars 2027."
      ]
    },
    {
      "intertitre": "Des retours possibles en novembre",
      "paragraphes": [
        "Krépin Diatta et Sadio Mané n'étaient pas sur la première liste ; leur retour est attendu. Pape Gueye et Ismaïla Sarr montent en puissance avec leurs clubs. Dans les buts, la hiérarchie reste à établir : Édouard Mendy a mis fin à sa carrière internationale après le Mondial."
      ]
    }
  ],
  "mots": 347,
  "lecture_min": 2,
  "theme": "foot",
  "pays": [
    "SN"
  ],
  "competition": "Éliminatoires CAN 2027",
  "source_nom": "Senego",
  "source_url": "https://senego.com/senegal-le-bilan-des-premiers-matchs-de-patrick-vieira-avant-la-fenetre-de-novembre-des-eliminatoires-de-la-can-2027_2017401.html",
  "publie_le": "2026-10-26T12:33:00.000Z",
  "redige_le": "2026-10-28T00:35:23.767Z",
  "image": {
    "url": "https://teiki5320.github.io/veille/images/keurfoot/13c6e86581517be5969d48dcc31c8efef0cd4f03.webp",
    "source": "wikimedia",
    "credit": "Simon Heseltine",
    "licence": "CC BY-SA 4.0",
    "page": "https://commons.wikimedia.org/wiki/File:Patrick_Vieira_NYCFC.JPG",
    "alt": "Patrick Vieira, sélectionneur du Sénégal",
    "mots_cles": [
      "Patrick Vieira"
    ],
    "largeur": 1600,
    "hauteur": 900
  }
}
